{
  "title": "프로토콜 합의 미팅",
  "duration_min": 60,
  "timezone": "Asia/Seoul",
  "candidates": [
    {"start": "2026-09-24T10:00:00+09:00", "end": "2026-09-24T11:00:00+09:00"},
    {"start": "2026-09-24T20:00:00+09:00", "end": "2026-09-24T21:00:00+09:00", "note": "야간"}
  ],
  "constraints": ["평일 배포 창(14~16시) 회피"]
}
